{
  "engineGoldenVersion": 1,
  "id": "default-profile-1990-dob",
  "description": "makeDefaultProfile-shaped inputs with fixed DOB for trajectory checks",
  "asOfDate": "2026-05-10",
  "taxYearLabel": "2026/27",
  "profile": {
    "dateOfBirth": "1990-05-10",
    "retirementTargetAge": 60,
    "targetRetirementIncome": 35000,
    "region": "england_wales",
    "partnered": false,
    "employment": "employed",
    "grossSalary": 60000,
    "bonus": 0,
    "salaryGrowth": 0.025,
    "statePensionClaimAge": 67,
    "statePensionWeekly": 241.3,
    "pensionPot": 50000,
    "employeeContribPct": 0.05,
    "employerContribPct": 0.05,
    "sippMonthly": 0,
    "pensionAccessAge": 57,
    "pensionGrowth": 0.05,
    "hasDB": false,
    "dbAnnualIncome": 0,
    "dbNRA": 65,
    "ssIsaValue": 25000,
    "ssIsaMonthly": 300,
    "cashIsaValue": 5000,
    "cashIsaRate": 0.035,
    "giaValue": 0,
    "giaMonthly": 0,
    "giaGrowth": 0.05,
    "isaGrowth": 0.05,
    "lisaValue": 0,
    "lisaMonthly": 0,
    "hasLisa": true,
    "hasGia": true,
    "primaryValue": 350000,
    "primaryMortgage": 200000,
    "primaryMortgagePayment": 1100,
    "primaryMortgageRate": 0.045,
    "primaryMortgageTermYears": 22,
    "primaryMortgageType": "repayment",
    "primaryAppreciation": 0.03,
    "primaryOverpayment": 0,
    "primaryLabel": "",
    "btlProperties": [],
    "cashSavings": 10000,
    "expectedInheritance": 0,
    "otherIncomeMonthly": 0,
    "monthlySurplus": 0,
    "cpi": 0.025,
    "cashRate": 0.035,
    "rentalGrowth": 0.030000000000000002,
    "spTripleLockGrowth": 0.025,
    "safeWithdrawalRate": 0.035,
    "leanFirePct": 0.7,
    "fatFirePct": 1.5,
    "baristaPartTimeIncome": 12000,
    "fireCalculationPrefs": {
      "offsetStatePension": false,
      "offsetDbPension": false,
      "offsetBtlNet": false,
      "referenceAgeMode": "at_retirement",
      "includePensionInPot": true,
      "includeSsIsaInPot": true,
      "includeCashIsaInPot": true,
      "includeLisaInPot": true,
      "includeGiaInPot": true,
      "includeCashInPot": true
    },
    "updatedAt": "2026-05-10T12:00:00.000Z"
  },
  "expected": {
    "fire": {
      "fireNumber": 999999.9999999999,
      "leanFireNumber": 699999.9999999999,
      "fatFireNumber": 1499999.9999999998,
      "coastFireNumber": 560827.8754610759,
      "baristaFireNumber": 657142.857142857,
      "investableNow": 90000,
      "fireProgressPct": 9.000000000000002,
      "coastFireProgressPct": 16.047704462979464,
      "yearsToFire": null,
      "fireAge": null,
      "coastReached": false,
      "savingsRate": 0.11
    },
    "projection": {
      "meta": {
        "currentAge": 36,
        "retirementAge": 60,
        "nmpa": 57,
        "spa": 67,
        "horizon": 65,
        "planningHorizonAge": 100,
        "steppedTaxYears": false
      },
      "yearSnapshots": [
        {
          "index": 0,
          "year": 2026,
          "age": 36,
          "totalNetWorth": 240000,
          "investableNetWorth": 90000,
          "pensionValue": 50000,
          "isaValue": 25000,
          "primaryEquity": 150000,
          "retired": false
        },
        {
          "index": 5,
          "year": 2031,
          "age": 41,
          "totalNetWorth": 388761.6688608484,
          "investableNetWorth": 153151.25839621492,
          "pensionValue": 90304.23356520395,
          "isaValue": 47100.90032729452,
          "primaryEquity": 235610.4104646335,
          "retired": false
        },
        {
          "index": 10,
          "year": 2036,
          "age": 46,
          "totalNetWorth": 566404.8565745908,
          "investableNetWorth": 228785.40251583635,
          "pensionValue": 140224.28693819905,
          "isaValue": 72031.75311853463,
          "primaryEquity": 337619.45405875443,
          "retired": false
        },
        {
          "index": 25,
          "year": 2051,
          "age": 61,
          "totalNetWorth": 1186670.2678798065,
          "investableNetWorth": 453847.9925008308,
          "pensionValue": 345203.1396698523,
          "isaValue": 89524.17125482569,
          "primaryEquity": 732822.2753789758,
          "retired": true
        },
        {
          "index": 64,
          "year": 2090,
          "age": 100,
          "totalNetWorth": 2330175.247237254,
          "investableNetWorth": 9307.327717860186,
          "pensionValue": 0,
          "isaValue": 0,
          "primaryEquity": 2320867.9195193937,
          "retired": true
        }
      ]
    }
  }
}
